{
  "schemaVersion": "flopeek-clean-room-package-report/v1",
  "generatedAt": "2026-07-27T05:48:21.462Z",
  "status": "passed",
  "evidenceClass": "clean-room-package-observation",
  "environment": {
    "nodeVersion": "24.18.0",
    "platform": "win32",
    "architecture": "x64",
    "lifecycleScriptsDuringInstall": false,
    "timingPolicy": "host-specific-non-gating",
    "installWarningsPresent": false
  },
  "packageAudit": {
    "schemaVersion": "flopeek-package-audit/v1",
    "status": "passed",
    "package": {
      "name": "flopeek",
      "version": "0.2.1-beta.3",
      "private": false,
      "filename": "flopeek-0.2.1-beta.3.tgz",
      "packedBytes": 967210,
      "unpackedBytes": 2603286,
      "entries": 180
    },
    "policy": {
      "schemaVersion": "flopeek-package-policy/v2",
      "maximumEntries": 190,
      "maximumUnpackedBytes": 2700000,
      "requiredPaths": 19,
      "releasePublishingApproved": false,
      "publicationState": "prepared",
      "distTag": "beta"
    },
    "checks": {
      "allowlist": true,
      "deniedContent": true,
      "requiredRuntime": true,
      "boundedSize": true,
      "packageIdentity": true,
      "releaseBoundary": true
    },
    "errors": [],
    "limitations": [
      "The inventory proves only the npm tarball file list and declared package metadata.",
      "It does not prove installation, command behavior, parser accuracy, runtime correctness, release readiness, or publication permission."
    ]
  },
  "artifact": {
    "filename": "flopeek-0.2.1-beta.3.tgz",
    "sha256": "c671501308e7d575a28b87c8dbfe9f0d4b3f19499a2e197892d4f515b475fdce",
    "packedBytes": 967210
  },
  "phases": [
    {
      "id": "pack-and-audit",
      "status": "passed",
      "milliseconds": 3414.044
    },
    {
      "id": "copy-fixture",
      "status": "passed",
      "milliseconds": 67.806
    },
    {
      "id": "install-tarball",
      "status": "passed",
      "milliseconds": 33231.532
    },
    {
      "id": "binary-version",
      "status": "passed",
      "milliseconds": 8142.54
    },
    {
      "id": "binary-help",
      "status": "passed",
      "milliseconds": 9919.758
    },
    {
      "id": "binary-doctor",
      "status": "passed",
      "milliseconds": 7916.689
    },
    {
      "id": "bounded-static-scan",
      "status": "passed",
      "milliseconds": 6248.609
    },
    {
      "id": "mcp-startup",
      "status": "passed",
      "milliseconds": 4613.714
    }
  ],
  "smoke": {
    "packageIdentity": {
      "expectedName": "flopeek",
      "actualName": "flopeek",
      "expectedVersion": "0.2.1-beta.3",
      "actualVersion": "0.2.1-beta.3",
      "binShimPresent": true
    },
    "version": {
      "expected": "0.2.1-beta.3",
      "actual": "0.2.1-beta.3",
      "matched": true
    },
    "help": {
      "rendered": true
    },
    "doctor": {
      "schemaVersion": "flopeek-agent-integration-doctor/v1",
      "ok": true,
      "errors": 0,
      "warnings": 11,
      "strict": false
    },
    "scan": {
      "schemaVersion": 5,
      "graphSchemaVersion": 5,
      "files": 12,
      "nodes": 29,
      "edges": 53,
      "applicationFlows": 1,
      "cacheStatus": "disabled"
    },
    "mcp": {
      "connected": true,
      "toolCount": 62,
      "requiredTools": {
        "getAgentBootstrap": true,
        "getFlowProjection": true,
        "resolveContextRef": true
      },
      "bootstrapSchemaVersion": "flopeek-agent-bootstrap/v1",
      "graphStatus": "advanced",
      "sourceWrites": "not-exposed",
      "targetExecution": "not-exposed"
    },
    "targetFixture": {
      "copied": true,
      "sourceFingerprintBefore": {
        "algorithm": "sha256",
        "value": "ae4b631b2116bd40a2b29d434859460d37e873bdd1ac281737b10153997614ed",
        "files": 16
      },
      "sourceFingerprintAfter": {
        "algorithm": "sha256",
        "value": "ae4b631b2116bd40a2b29d434859460d37e873bdd1ac281737b10153997614ed",
        "files": 16
      },
      "unchanged": true,
      "applicationExecuted": false,
      "testCommandExecuted": false
    }
  },
  "cleanup": {
    "status": "passed",
    "milliseconds": 9412.09
  },
  "publication": {
    "attempted": false,
    "approved": false
  },
  "limitations": [
    "This report proves only one isolated tarball pack, install, and bounded static command sequence on the declared host.",
    "It does not prove every operating system, registry publication, upgrade compatibility, runtime application behavior, parser accuracy, or alpha/beta/stable readiness.",
    "The target fixture is copied before scanning; no target application, test command, package script, or arbitrary shell command is executed.",
    "MCP startup verifies protocol and bounded graph tools. Metadata-writing MCP tools remain non-source-writing and are not invoked by this check."
  ]
}
